{
  "schema_version": "fixture-manifest-v0",
  "fixture_id": "fixture:synthetic-v0",
  "status": "synthetic",
  "grid": {
    "rows": 256,
    "columns": 256,
    "cell_size_mm": 1000,
    "row_zero": "north",
    "column_zero": "west"
  },
  "local_frame": {
    "axes": "east-north-up",
    "origin_latitude_microdegrees": 0,
    "origin_longitude_microdegrees": 0,
    "datum_elevation_mm": 0
  },
  "source": {
    "kind": "synthetic-formula",
    "product_id": "synthetic-v0-formula-1",
    "uri": "urn:open-prospector:fixture:synthetic-v0",
    "source_hash": "sha256:323637c779cf747227ba402a22ab82ff37132c280dbba89b20bd3185b5c5e182",
    "source_scale_mm_per_pixel": 1000,
    "license_note": "CC0 test fixture generated by the Open Prospector implementation."
  },
  "crop": {
    "source_row": 0,
    "source_column": 0,
    "source_rows": 256,
    "source_columns": 256,
    "resampler": "nearest-pixel-1to1",
    "rounding": "half-away-from-zero-to-mm"
  },
  "layers": [
    { "name": "truth-elevation", "scope": "truth", "path": "truth-elevation.i32le", "encoding": "int32-le-mm", "byte_length": 262144, "hash": "sha256:89d95bcffe95d9153e463c3c329d93eacc97120abc66d136c9d70fda83a3098a" },
    { "name": "truth-obstacles", "scope": "truth", "path": "truth-obstacles.u8", "encoding": "uint8-bool", "byte_length": 65536, "hash": "sha256:3780b5ed4112b1ff6733a04ff91b4ff2b7716f8ac32318d02d7e970bd21484b2" },
    { "name": "geofence", "scope": "public", "path": "geofence.u8", "encoding": "uint8-bool", "byte_length": 65536, "hash": "sha256:af7c2adbcd9541b8337c27dadc3fb664ef97eaf98ec45e2ec949e404bbcdafbd" },
    { "name": "asset-initial-elevation", "scope": "asset-initial", "path": "asset-initial-elevation.i32le", "encoding": "int32-le-mm", "byte_length": 262144, "hash": "sha256:89d95bcffe95d9153e463c3c329d93eacc97120abc66d136c9d70fda83a3098a" },
    { "name": "asset-initial-obstacles", "scope": "asset-initial", "path": "asset-initial-obstacles.u8", "encoding": "uint8-bool", "byte_length": 65536, "hash": "sha256:de2f256064a0af797747c2b97505dc0b9f3df0de4f489eac731c23ae9ca9cc31" },
    { "name": "asset-initial-known", "scope": "asset-initial", "path": "asset-initial-known.u8", "encoding": "uint8-bool", "byte_length": 65536, "hash": "sha256:916b144867c340614f515c7b0e5415c74832d899c05264ded2a277a6e81d81ff" },
    { "name": "asset-initial-uncertainty", "scope": "asset-initial", "path": "asset-initial-uncertainty.u32le", "encoding": "uint32-le-mm", "byte_length": 262144, "hash": "sha256:8a39d2abd3999ab73c34db2476849cddf303ce389b35826850f9a700589b4a90" },
    { "name": "mission-initial-elevation", "scope": "mission-initial", "path": "mission-initial-elevation.i32le", "encoding": "int32-le-mm", "byte_length": 262144, "hash": "sha256:89d95bcffe95d9153e463c3c329d93eacc97120abc66d136c9d70fda83a3098a" },
    { "name": "mission-initial-obstacles", "scope": "mission-initial", "path": "mission-initial-obstacles.u8", "encoding": "uint8-bool", "byte_length": 65536, "hash": "sha256:de2f256064a0af797747c2b97505dc0b9f3df0de4f489eac731c23ae9ca9cc31" },
    { "name": "mission-initial-known", "scope": "mission-initial", "path": "mission-initial-known.u8", "encoding": "uint8-bool", "byte_length": 65536, "hash": "sha256:916b144867c340614f515c7b0e5415c74832d899c05264ded2a277a6e81d81ff" },
    { "name": "mission-initial-uncertainty", "scope": "mission-initial", "path": "mission-initial-uncertainty.u32le", "encoding": "uint32-le-mm", "byte_length": 262144, "hash": "sha256:8a39d2abd3999ab73c34db2476849cddf303ce389b35826850f9a700589b4a90" }
  ]
}
