{"crop":{"resampler":"nearest-pixel-1to1","rounding":"half-away-from-zero-to-mm","source_column":4096,"source_columns":256,"source_row":7680,"source_rows":256},"fixture_id":"fixture:candor-sw-v0","grid":{"cell_size_mm":1000,"column_zero":"west","columns":256,"row_zero":"north","rows":256},"layers":[{"byte_length":262144,"encoding":"int32-le-mm","hash":"sha256:af3962ad9fc181c8fbf860e1070d51b6fb032c3e0606cc7195ce89aaa8df6505","name":"truth-elevation","path":"truth-elevation.i32le","scope":"truth"},{"byte_length":65536,"encoding":"uint8-bool","hash":"sha256:3780b5ed4112b1ff6733a04ff91b4ff2b7716f8ac32318d02d7e970bd21484b2","name":"truth-obstacles","path":"truth-obstacles.u8","scope":"truth"},{"byte_length":65536,"encoding":"uint8-bool","hash":"sha256:af7c2adbcd9541b8337c27dadc3fb664ef97eaf98ec45e2ec949e404bbcdafbd","name":"geofence","path":"geofence.u8","scope":"public"},{"byte_length":262144,"encoding":"int32-le-mm","hash":"sha256:af3962ad9fc181c8fbf860e1070d51b6fb032c3e0606cc7195ce89aaa8df6505","name":"asset-initial-elevation","path":"asset-initial-elevation.i32le","scope":"asset-initial"},{"byte_length":65536,"encoding":"uint8-bool","hash":"sha256:de2f256064a0af797747c2b97505dc0b9f3df0de4f489eac731c23ae9ca9cc31","name":"asset-initial-obstacles","path":"asset-initial-obstacles.u8","scope":"asset-initial"},{"byte_length":65536,"encoding":"uint8-bool","hash":"sha256:916b144867c340614f515c7b0e5415c74832d899c05264ded2a277a6e81d81ff","name":"asset-initial-known","path":"asset-initial-known.u8","scope":"asset-initial"},{"byte_length":262144,"encoding":"uint32-le-mm","hash":"sha256:8a39d2abd3999ab73c34db2476849cddf303ce389b35826850f9a700589b4a90","name":"asset-initial-uncertainty","path":"asset-initial-uncertainty.u32le","scope":"asset-initial"},{"byte_length":262144,"encoding":"int32-le-mm","hash":"sha256:af3962ad9fc181c8fbf860e1070d51b6fb032c3e0606cc7195ce89aaa8df6505","name":"mission-initial-elevation","path":"mission-initial-elevation.i32le","scope":"mission-initial"},{"byte_length":65536,"encoding":"uint8-bool","hash":"sha256:de2f256064a0af797747c2b97505dc0b9f3df0de4f489eac731c23ae9ca9cc31","name":"mission-initial-obstacles","path":"mission-initial-obstacles.u8","scope":"mission-initial"},{"byte_length":65536,"encoding":"uint8-bool","hash":"sha256:916b144867c340614f515c7b0e5415c74832d899c05264ded2a277a6e81d81ff","name":"mission-initial-known","path":"mission-initial-known.u8","scope":"mission-initial"},{"byte_length":262144,"encoding":"uint32-le-mm","hash":"sha256:8a39d2abd3999ab73c34db2476849cddf303ce389b35826850f9a700589b4a90","name":"mission-initial-uncertainty","path":"mission-initial-uncertainty.u32le","scope":"mission-initial"}],"local_frame":{"axes":"east-north-up","datum_elevation_mm":0,"origin_latitude_microdegrees":-6513281,"origin_longitude_microdegrees":283087766},"preparation":{"hash":"sha256:fc3f7885b0c012b62bdb1d2ec2527140caadf666598f9d2e8a7b69fd52dde393","path":"preparation.json"},"schema_version":"fixture-manifest-v0","source":{"kind":"hirise-pds-dtm","license_note":"NASA/JPL-Caltech/University of Arizona product; preserve source credit and provenance.","product_id":"DTEEC_001918_1735_001984_1735_U01","source_hash":"sha256:3e2a3be3176284b401a809afd69d8dab632ef839c4e5e79826a1889637f6801a","source_scale_mm_per_pixel":1012,"uri":"https://hirise.lpl.arizona.edu/PDS/DTM/PSP/ORB_001900_001999/PSP_001918_1735_PSP_001984_1735/DTEEC_001918_1735_001984_1735_U01.IMG"},"status":"materialized"}
